{
  "action_id": "A001",
  "attempt_id": "ppgt_scale-v1",
  "category": "training",
  "cost_event_id": "cost-T-modern2d-ppgt-research-slot2-s42-v1-ppgt_scale-planned",
  "evidence_ref": "experiments/modern2d_configured_100k/research_arms/ppgt2/authority.json",
  "hardware": "NvidiaTeslaT4x2",
  "measurement": {
    "cpu_hours": {
      "status": "measurement_missing",
      "value": null
    },
    "device_hours": {
      "status": "estimated",
      "value": 10
    },
    "queue_hours": {
      "status": "measurement_missing",
      "value": null
    },
    "wall_hours": {
      "status": "estimated",
      "value": 5
    }
  },
  "platform": "kaggle",
  "run_id": "modern2d-ppgt-research-slot2-s42-v1:ppgt_scale:downstream",
  "schema": "molgap-cost-event-v1",
  "trajectory_id": "T-modern2d-ppgt-research-slot2-s42-v1-ppgt_scale"
}
