{
  "action_id": "A001",
  "attempt_id": "pcqm-k1-init-forward-500k-single-s42-v2",
  "category": "other",
  "cost_event_id": "cost-terminal-T-pcqm-k1-init-forward-500k-single-s42-pretrained-allocation-0",
  "evidence_ref": "experiments/pcqm_k1_initialization_forward_500k/runs/pcqm-k1-init-forward-500k-single-s42/prospective/pretrained/terminal_staging/v1/41d0fb53e395f963/observed.json",
  "hardware": "Tesla T4",
  "measurement": {
    "cpu_hours": {
      "status": "measurement_missing",
      "value": null
    },
    "device_hours": {
      "status": "measured",
      "value": 3.3693557703502774
    },
    "queue_hours": {
      "status": "measurement_missing",
      "value": null
    },
    "wall_hours": {
      "status": "measurement_missing",
      "value": null
    }
  },
  "platform": "kaggle",
  "run_id": "pcqm-k1-init-forward-500k-single-s42:pretrained:downstream",
  "schema": "molgap-cost-event-v1",
  "trajectory_id": "T-pcqm-k1-init-forward-500k-single-s42-pretrained"
}
