{
  "action_id": "A001",
  "attempt_id": "candidate-v1",
  "category": "training",
  "cost_event_id": "cost-TC-k1-conjugated-persistent-100k-s42-training",
  "evidence_ref": "experiments/pcqm_k1_conjugated_hyperedge_100k/arms/persistent/results/terminal_acceptance.json",
  "hardware": "Tesla_T4_16GB",
  "measurement": {
    "cpu_hours": {
      "status": "measurement_missing",
      "value": null
    },
    "device_hours": {
      "status": "measured",
      "value": 2.0336450138530546
    },
    "queue_hours": {
      "status": "measurement_missing",
      "value": null
    },
    "wall_hours": {
      "status": "measurement_missing",
      "value": null
    }
  },
  "platform": "kaggle2",
  "run_id": "kaseichou/molgap-k1-conjugated-dual-s42:v1-planned",
  "schema": "molgap-cost-event-v1",
  "trajectory_id": "TC-k1-conjugated-persistent-100k-s42"
}
