{
  "action_id": "A001",
  "attempt_id": "unknown",
  "category": "other",
  "cost_event_id": "cost-finalize-86279b3dc2aa844eed6e3ce3",
  "evidence_ref": "experiments/pcqm_gptrans_geometry_channels_100k_kaggle1/prospective/distance_only/rml_finalized/v5_evidence.json",
  "hardware": "unknown",
  "measurement": {
    "cpu_hours": {
      "status": "measurement_missing",
      "value": null
    },
    "device_hours": {
      "status": "measurement_missing",
      "value": null
    },
    "queue_hours": {
      "status": "measurement_missing",
      "value": null
    },
    "wall_hours": {
      "status": "measurement_missing",
      "value": null
    }
  },
  "platform": "unknown",
  "run_id": "kaggle1-gptrans-geometry-distance-100k-s42-v1",
  "schema": "molgap-cost-event-v1",
  "trajectory_id": "TB-gptrans-geometry-distance-100k-s42"
}
