{
  "action_id": "A001",
  "attempt_id": "unknown",
  "category": "other",
  "cost_event_id": "cost-finalize-37028ebe7f0875faf2c75c0a",
  "evidence_ref": "experiments/pcqm_k1_joint_atom_reconstruction_100k/attempts/v2/audit/rml_plan/rml_finalized/v5_evidence.json",
  "hardware": "unknown",
  "measurement": {
    "cpu_hours": {
      "status": "measurement_missing",
      "value": null
    },
    "device_hours": {
      "status": "measurement_missing",
      "value": null
    },
    "queue_hours": {
      "status": "measurement_missing",
      "value": null
    },
    "wall_hours": {
      "status": "measurement_missing",
      "value": null
    }
  },
  "platform": "unknown",
  "run_id": "kaseichou/molgap-k1-joint-atom-s42:v2",
  "schema": "molgap-cost-event-v1",
  "trajectory_id": "TC-k1-joint-atom-post100k-audit-s42-v2"
}
