{
  "action_id": "A001",
  "attempt_id": "pcqm-k1-rms-scope-gain-160ep-100k-s42-20261022-v1",
  "category": "training",
  "cost_event_id": "cost-T-pcqm-k1-rms-scope-gain-160ep-100k-s42-20261022-post_node_ada-planned",
  "evidence_ref": "experiments/pcqm_k1_norm_mechanisms_100k/scope_gain/authority.json",
  "hardware": "Tesla T4x2 FP32",
  "measurement": {
    "cpu_hours": {
      "status": "measurement_missing",
      "value": null
    },
    "device_hours": {
      "status": "estimated",
      "value": 6.5
    },
    "queue_hours": {
      "status": "measurement_missing",
      "value": null
    },
    "wall_hours": {
      "status": "estimated",
      "value": 6.5
    }
  },
  "platform": "kaggle",
  "run_id": "pcqm-k1-rms-scope-gain-160ep-100k-s42-20261022:post_node_ada:downstream",
  "schema": "molgap-cost-event-v1",
  "trajectory_id": "T-pcqm-k1-rms-scope-gain-160ep-100k-s42-20261022-post_node_ada"
}
