{
  "action_id": "A001",
  "attempt_id": "kaggle3-flag-001",
  "category": "preflight",
  "cost_event_id": "cost-TB-k1-flag-kaggle3-100k-s42-v1-observed-preflight",
  "evidence_ref": "experiments/pcqm_k1_flag/training_acceptance.json",
  "hardware": "Tesla T4; exclusive assigned invocation lower bound",
  "measurement": {
    "cpu_hours": {
      "status": "measurement_missing",
      "value": null
    },
    "device_hours": {
      "status": "measured",
      "value": 0.0029718552022222236
    },
    "queue_hours": {
      "status": "measurement_missing",
      "value": null
    },
    "wall_hours": {
      "status": "measured",
      "value": 0.0029718552022222236
    }
  },
  "platform": "kaggle3",
  "run_id": "molgap-k1-flag-100k-s42-v1:flag:downstream",
  "schema": "molgap-cost-event-v1",
  "trajectory_id": "TB-k1-flag-kaggle3-100k-s42-v1"
}
