{
  "schema": "molgap-cost-event-v1",
  "cost_event_id": "cost-TC-k1-pair-token-frozen-cross-scale-20260924",
  "trajectory_id": "TC-k1-pair-token-frozen-cross-scale-20260924",
  "action_id": "A001",
  "run_id": "pending-kunshan-sbatch",
  "attempt_id": "pending-preflight-and-full",
  "category": "inference",
  "platform": "scnet-kunshan",
  "hardware": "one allocated Hygon DCU",
  "measurement": {
    "device_hours": {"value": null, "status": "measurement_missing"},
    "cpu_hours": {"value": null, "status": "measurement_missing"},
    "wall_hours": {"value": null, "status": "measurement_missing"},
    "queue_hours": {"value": null, "status": "measurement_missing"}
  },
  "evidence_ref": "experiments/pcqm_k1_cross_scale_frozen/budget_snapshot.json"
}
