{
  "action_id": "A001",
  "attempt_id": "pcqm-k1-init-forward-500k-single-s42-v1",
  "category": "training",
  "cost_event_id": "cost-T-pcqm-k1-init-forward-500k-single-s42-scratch-planned",
  "evidence_ref": "experiments/pcqm_k1_initialization_forward_500k/single/authority.json",
  "hardware": "Tesla T4 FP32",
  "measurement": {
    "cpu_hours": {
      "status": "measurement_missing",
      "value": null
    },
    "device_hours": {
      "status": "estimated",
      "value": 18
    },
    "queue_hours": {
      "status": "measurement_missing",
      "value": null
    },
    "wall_hours": {
      "status": "estimated",
      "value": 9
    }
  },
  "platform": "kaggle",
  "run_id": "pcqm-k1-init-forward-500k-single-s42:scratch:downstream",
  "schema": "molgap-cost-event-v1",
  "trajectory_id": "T-pcqm-k1-init-forward-500k-single-s42-scratch"
}
