{
  "action_id": "A001",
  "attempt_id": "attempt-001",
  "category": "training",
  "cost_event_id": "cost-TB-pretraining-gptrans_joint-100k-s42-expected-release2",
  "evidence_ref": "experiments/pcqm_pretraining_family_pair/training_contract.json",
  "hardware": "NvidiaTeslaT4_requested",
  "measurement": {
    "cpu_hours": {
      "status": "measurement_missing",
      "value": null
    },
    "device_hours": {
      "status": "measurement_missing",
      "value": null
    },
    "queue_hours": {
      "status": "measurement_missing",
      "value": null
    },
    "wall_hours": {
      "status": "measurement_missing",
      "value": null
    }
  },
  "platform": "kaggle",
  "run_id": "kaggle1-pretraining-family-pair-100k-s42-v2",
  "schema": "molgap-cost-event-v1",
  "trajectory_id": "TB-pretraining-gptrans_joint-100k-s42-release2"
}
