{
  "action_id": "A001",
  "attempt_id": "v1",
  "category": "training",
  "cost_event_id": "cost-TC-gptrans-g1-local-connected-pair-100k-s42-observed-v1",
  "evidence_ref": "experiments/pcqm_gptrans_local_relation_100k/gpu/degree_local_connected_pair_ema999/results/observed_metadata.json",
  "hardware": "Tesla_T4",
  "measurement": {
    "cpu_hours": {
      "status": "measurement_missing",
      "value": null
    },
    "device_hours": {
      "status": "measured",
      "value": 4.5145705422011115
    },
    "queue_hours": {
      "status": "measurement_missing",
      "value": null
    },
    "wall_hours": {
      "status": "measured",
      "value": 4.5145705422011115
    }
  },
  "platform": "kaggle2-t4-gptrans-local-relation",
  "run_id": "gptrans-local-relation-dual-s42:degree_local_connected_pair_ema999",
  "schema": "molgap-cost-event-v1",
  "trajectory_id": "TC-gptrans-g1-local-connected-pair-100k-s42"
}
