{
  "action_id": "A001",
  "attempt_id": "attempt-001",
  "category": "training",
  "cost_event_id": "cost-TB-geometry-v4-500k-k1_distance_angle-s42-expected-training",
  "evidence_ref": "experiments/pcqm_geometry_v4_500k_pair/training_contract.json",
  "hardware": "NvidiaTeslaT4_requested",
  "measurement": {
    "cpu_hours": {
      "status": "measurement_missing",
      "value": null
    },
    "device_hours": {
      "status": "measurement_missing",
      "value": null
    },
    "queue_hours": {
      "status": "measurement_missing",
      "value": null
    },
    "wall_hours": {
      "status": "measurement_missing",
      "value": null
    }
  },
  "platform": "kaggle",
  "run_id": "nothingnessvoid/molgap-geometry-v4-500k-paired-s42-v1/k1_distance_angle/attempt-001",
  "schema": "molgap-cost-event-v1",
  "trajectory_id": "TB-geometry-v4-500k-k1_distance_angle-s42"
}
