{
  "action_id": "A001",
  "attempt_id": "attempt-002",
  "category": "training",
  "cost_event_id": "cost-TB-gptrans-geometry-distance-100k-s42-a2-observed-training",
  "evidence_ref": "experiments/pcqm_gptrans_geometry_channels_100k_kaggle1/prospective_attempt_002/distance_only/terminal_inputs/cost_records.json",
  "hardware": "Tesla T4",
  "measurement": {
    "cpu_hours": {
      "status": "measurement_missing",
      "value": null
    },
    "device_hours": {
      "status": "measured",
      "value": 2.7594684600797232
    },
    "queue_hours": {
      "status": "measurement_missing",
      "value": null
    },
    "wall_hours": {
      "status": "measured",
      "value": 2.7594684600797232
    }
  },
  "platform": "kaggle",
  "run_id": "kaggle1-gptrans-geometry-distance-100k-s42-v2",
  "schema": "molgap-cost-event-v1",
  "trajectory_id": "TB-gptrans-geometry-distance-100k-s42-a2"
}
